{
  "name": "research-images",
  "description": "Research-image inspection with explicit source identity, transformation history, measurement definitions, exclusions, and interpretation boundaries.",
  "version": "0.2.0",
  "author": {
    "name": "Evidence Lab"
  },
  "keywords": [
    "research-image-analysis"
  ],
  "homepage": "https://github.com/timsmykov/evidence-lab-plugins",
  "repository": "https://github.com/timsmykov/evidence-lab-plugins",
  "license": "MIT"
}
