{
  "name": "example-domain",
  "description": "A non-published reference pack that demonstrates the Evidence Lab package structure, routing evaluations, deterministic scripts, and review metadata.",
  "version": "0.1.6",
  "author": {
    "name": "Evidence Lab"
  },
  "keywords": [
    "reference-fixture"
  ],
  "homepage": "https://github.com/timsmykov/evidence-lab-plugins",
  "repository": "https://github.com/timsmykov/evidence-lab-plugins",
  "license": "MIT"
}
