{
  "name": "evidence-lab-operations",
  "description": "Internal Evidence Lab operations pack for converting incoming work into executable task cards and maintaining a deterministic per-owner queue.",
  "version": "0.1.0",
  "author": {
    "name": "Evidence Lab"
  },
  "keywords": [
    "task-intake",
    "task-prioritization",
    "task-archiving"
  ],
  "homepage": "https://github.com/timsmykov/evidence-lab-plugins",
  "repository": "https://github.com/timsmykov/evidence-lab-plugins",
  "license": "MIT"
}
