{
  "name": "evidence-lab-meeting-capture",
  "description": "Turn Evidence Lab meeting transcripts or notes into source-bounded summaries and register each completed summary in the canonical Notion meeting database.",
  "version": "0.1.0",
  "author": {
    "name": "Evidence Lab"
  },
  "keywords": [
    "evidence-lab-meeting-capture"
  ],
  "homepage": "https://github.com/timsmykov/evidence-lab-plugins",
  "repository": "https://github.com/timsmykov/evidence-lab-plugins",
  "license": "MIT"
}
