{
  "name": "literature-publication",
  "description": "Literature synthesis, evidence-bounded academic writing, editable research diagrams, manuscript review, and source-backed LaTeX venue formatting without installing study-design procedures.",
  "version": "0.4.0",
  "author": {
    "name": "Evidence Lab"
  },
  "keywords": [
    "literature-review",
    "academic-writing",
    "peer-review",
    "research-diagrams",
    "latex-and-venue-formatting"
  ],
  "homepage": "https://github.com/timsmykov/evidence-lab-plugins",
  "repository": "https://github.com/timsmykov/evidence-lab-plugins",
  "license": "MIT AND Apache-2.0"
}
