{
  "name": "qualitative-research",
  "description": "Traceable qualitative-text analysis using an explicit codebook, coded excerpts, reflexive notes, disagreements, and evidence-bounded thematic synthesis.",
  "version": "0.1.0",
  "author": {
    "name": "Evidence Lab"
  },
  "keywords": [
    "qualitative-analysis"
  ],
  "homepage": "https://github.com/timsmykov/evidence-lab-plugins",
  "repository": "https://github.com/timsmykov/evidence-lab-plugins",
  "license": "LicenseRef-Evidence-Lab-Proprietary"
}
