{
  "name": "full-research-cycle",
  "description": "A complete research workflow from testable hypotheses and study design through literature synthesis, manuscript writing, diagrams, and evidence-bounded peer review.",
  "version": "0.1.0",
  "author": {
    "name": "Evidence Lab"
  },
  "keywords": [
    "hypothesis-generation",
    "study-design",
    "literature-review",
    "academic-writing",
    "peer-review",
    "research-diagrams"
  ],
  "homepage": "https://github.com/timsmykov/evidence-lab-plugins",
  "repository": "https://github.com/timsmykov/evidence-lab-plugins",
  "license": "MIT AND Apache-2.0"
}
