{
  "name": "document-evidence",
  "description": "Reproducible conversion of supported research documents into inspectable Markdown without installing database retrieval or dataset analysis tools.",
  "version": "0.2.0",
  "author": {
    "name": "Evidence Lab"
  },
  "keywords": [
    "document-conversion"
  ],
  "homepage": "https://github.com/timsmykov/evidence-lab-plugins",
  "repository": "https://github.com/timsmykov/evidence-lab-plugins",
  "license": "MIT"
}
