{
  "name": "evidence-lab-core",
  "description": "Agent-first research foundations, fast researcher onboarding, personal skill creation, reproducible pack selection, source verification, citation handling, and scientific critical thinking.",
  "version": "0.13.0",
  "author": {
    "name": "Evidence Lab"
  },
  "keywords": [
    "onboarding",
    "pack-selection",
    "companion-plugin-planning",
    "installation-lifecycle",
    "personal-skill-authoring",
    "paper-lookup",
    "citation-management",
    "critical-thinking"
  ],
  "homepage": "https://github.com/timsmykov/evidence-lab-plugins",
  "repository": "https://github.com/timsmykov/evidence-lab-plugins",
  "license": "MIT"
}
